id,name
2610/11_dep_1,Sri Lanka Army
2610/11_dep_2,Sri Lanka Navy
2610/11_dep_3,Sri Lanka Air Force
2610/11_dep_4,Department of Civil Security
2610/11_dep_5,Sir John Kotelawala Defence University
2610/11_dep_6,Defence Services Command and Staff College
2610/11_dep_7,Ranaviru Seva Authority
2610/11_dep_8,Defence Services School
2610/11_dep_9,National Cadet Corps
2610/11_dep_10,National Defence Fund
2610/11_dep_11,State Intelligence Service
2610/11_dep_12,Coast Guard Department of Sri Lanka
2610/11_dep_13,Lanka Logistics Limited
2610/11_dep_14,Rakna Arakshana Lanka Ltd.
2610/11_dep_15,Mahaweli Authority of Sri Lanka (except Mahaweli Livestock Enterprise Company Ltd.)
2610/11_dep_16,Moragahakanda and Kalu Ganga Reservoir Project
2610/11_dep_17,Dam Safety & Water Resources Planning Project
2610/11_dep_18,Mahaweli Consolidation Project (System B Rehabilitation)
2610/11_dep_19,Udawalawe Left Bank Project
2610/11_dep_20,Uma Oya Development Project
2610/11_dep_21,Department of Forests
2610/11_dep_22,Central Environmental Authority
2610/11_dep_23,Geological Survey and Mines Bureau
2610/11_dep_24,GSMB Technical Services (Pvt) Ltd.
2610/11_dep_25,State Timber Corporation
2610/11_dep_26,National Gem and Jewellery Authority
2610/11_dep_27,Gem and Jewellery Research Institute
2610/11_dep_28,Lanka Timber Plant and Industries
2610/11_dep_29,Marine Environment Protection Authority
2610/11_dep_30,Department of Coast Conservation
2610/11_dep_31,Central Engineering Consultancy Bureau and its subsidiary companies and associates
2610/11_dep_32,Department of National Planning
2610/11_dep_33,Central Bank of Sri Lanka
2610/11_dep_34,Department of External Resources
2610/11_dep_35,Department of Census and Statistics
2610/11_dep_36,Institute of Policy Studies
2610/11_dep_37,National Operations Room
2610/11_dep_38,Department of Project Management and Monitoring
2610/11_dep_39,Securities and Exchange Commission of Sri Lanka
2610/11_dep_40,Credit Information Bureau
2610/11_dep_41,National Pay Commission
2610/11_dep_42,National Insurance Trust Fund
2610/11_dep_43,"Strike, Riot and Civil Commotion and Terrorism Fund"
2610/11_dep_44,Employees’ Trust Fund
2610/11_dep_45,Public Utilities Commission of Sri Lanka
2610/11_dep_46,National Human Resources Development Council
2610/11_dep_47,National Youth Services Council
2610/11_dep_48,National Youth Corps
2610/11_dep_49,National Youth Awards Authority
2610/11_dep_50,National Youths Services Co-operative Limited
2610/11_dep_51,National Centre for Leadership Development
2610/11_dep_52,Sri Lanka Tourism Promotion Bureau
2610/11_dep_53,Sri Lanka Tourism Development Authority
2610/11_dep_54,Sri Lanka Exhibition and Convention Bureau
2610/11_dep_55,Sri Lanka Institute of Tourism and Hotel Management
2610/11_dep_56,Department of Christian Religious Affairs
2610/11_dep_57,Department of National Zoological Gardens
2610/11_dep_58,Department of National Botanical Gardens
2610/11_dep_59,Department of Wildlife Conservation
2610/11_dep_60,Wildlife Trust
2610/11_dep_61,Department of Sri Lanka Railways
2610/11_dep_62,Sri Lanka Central Transport Board
2610/11_dep_63,National Transport Medical Institute
2610/11_dep_64,Department of Motor Traffic
2610/11_dep_65,National Transport Commission
2610/11_dep_66,Civil Aviation Authority
2610/11_dep_67,Airport and Aviation Services (Sri Lanka) Ltd.
2610/11_dep_68,Diplomatic Missions Abroad
2610/11_dep_69,Lakshman Kadirgamar Institute for International Relations and Strategic Studies
2610/11_dep_70,National Oceanic Affairs Committee Secretariat
2610/11_dep_71,Department of Social Services
2610/11_dep_72,National Secretariat for Elders and National Council for Elders
2610/11_dep_73,National Secretariat for Persons with Disabilities
2610/11_dep_74,National Council for Persons with Disabilities
2610/11_dep_75,National Institute of Social Development
2610/11_dep_76,Department of Divineguma Development
2610/11_dep_77,Rural Development Training and Research Institute
2610/11_dep_78,Social Security Board
2610/11_dep_79,Department of Labour
2610/11_dep_80,National Institute of Labour Studies
2610/11_dep_81,Employees' Provident Fund
2610/11_dep_82,National Institute for Occupational Safety and Health
2610/11_dep_83,Office of the Commissioner of Workmen's Compensation
2610/11_dep_84,Shrama Vasana Fund
2610/11_dep_85,Department of Manpower and Employment
2610/11_dep_86,Sri Lanka Job Net Ltd.
2610/11_dep_87,University Grants Commission
2610/11_dep_88,All Universities under the purview of University Grants Commission
2610/11_dep_89,All Postgraduate Institutions and other Institutions under the purview of the University Grants Commission
2610/11_dep_90,Buddhasravaka Bhiksu University
2610/11_dep_91,Buddhist and Pali University
2610/11_dep_92,Road Development Authority and its Subsidiaries and Associates
2610/11_dep_93,Road Maintenance Trust Fund
2610/11_dep_94,National Water Supply and Drainage Board (NWS&DB)
2610/11_dep_95,Department of National Community Water Supply
2610/11_dep_96,National Disaster Management Council
2610/11_dep_97,Disaster Management Centre
2610/11_dep_98,National Disaster Relief Services Centre
2610/11_dep_99,Department of Meteorology
2610/11_dep_100,National Building Research Organization
2610/11_dep_101,Sri Lanka Institute of Nanotechnology (Pvt.) Ltd.
2610/11_dep_102,National Institute of Fundamental Studies
2610/11_dep_103,National Science Foundation
2610/11_dep_104,National Science and Technology Commission
2610/11_dep_105,Planetarium
2610/11_dep_106,Arthur C. Clarke Centre for Modern Technology
2610/11_dep_107,Sri Lanka Accreditation Board for Conformity Assessment
2610/11_dep_108,Department of Police
2610/11_dep_109,National Dangerous Drugs Control Board
2610/11_dep_110,Department of Prisons
2610/11_dep_111,Community Based Correction Department
2610/11_dep_112,Training Schools for Youthful Offenders
2610/11_dep_113,Department of Health Services
2610/11_dep_114,Sri Jayewardenepura General Hospital
2610/11_dep_115,Vijaya Kumaranatunga Memorial Hospital
2610/11_dep_116,State Pharmaceutical Corporation
2610/11_dep_117,State Pharmaceutical Manufacturing Corporation
2610/11_dep_118,"All National, Teaching and Specified Government Hospitals"
2610/11_dep_119,National Health Council
2610/11_dep_120,Medical Research Institute
2610/11_dep_121,National Institute of Health Science
2610/11_dep_122,Ashraff Memorial Hospital
2610/11_dep_123,School of Medical Laboratory Technology
2610/11_dep_124,Sri Lanka Medical Council
2610/11_dep_125,Sri Lanka Medical College Council
2610/11_dep_126,National Health Development Fund
2610/11_dep_127,Private Medical Institute Council
2610/11_dep_128,"National Institute of Nephrology, Dialysis and Transplantation"
2610/11_dep_129,Sri Lanka Thriposha Ltd.
2610/11_dep_130,National Authority on Tobacco and Alcohol
2610/11_dep_131,Department of Ayurveda
2610/11_dep_132,Sri Lanka Ayurvedic Drugs Corporation
2610/11_dep_133,Ayurvedic Medical Council
2610/11_dep_134,Ayurvedic College and Hospital Board
2610/11_dep_135,Ayurveda Teaching Hospitals
2610/11_dep_136,Homeopathy Hospital Welisara
2610/11_dep_137,Homeopathy Medical Council
2610/11_dep_138,General Treasury
2610/11_dep_139,Department of Fiscal Policy
2610/11_dep_140,Department of National Budget
2610/11_dep_141,Department of Public Enterprises
2610/11_dep_142,Department of Public Finance
2610/11_dep_143,Department of Treasury Operations
2610/11_dep_144,Department of Public Accounts
2610/11_dep_145,Department of Trade & Investment Policy
2610/11_dep_146,Department of Development Finance
2610/11_dep_147,Department of Management Audit
2610/11_dep_148,Department of Information Technology Management
2610/11_dep_149,Department of Legal Affairs
2610/11_dep_150,Department of Inland Revenue
2610/11_dep_151,Department of Valuation
2610/11_dep_152,Department of Management Services
2610/11_dep_153,Sri Lanka Customs
2610/11_dep_154,Department of Excise
2610/11_dep_155,Insurance Board of Sri Lanka
2610/11_dep_156,Sri Lanka Accounting and Auditing Standards Monitoring Board
2610/11_dep_157,Public Service Mutual Provident Association
2610/11_dep_158,National Lotteries Board
2610/11_dep_159,Development Lotteries Board
2610/11_dep_160,Lady Lochore Fund
2610/11_dep_161,Tax Appeals Commission
2610/11_dep_162,Sri Lanka Export Credit Insurance Corporation
2610/11_dep_163,Academy of Financial Studies (Miloda)
2610/11_dep_164,Tertiary and Vocational Education Commission
2610/11_dep_165,Vocational Training Authority of Sri Lanka
2610/11_dep_166,National Apprenticeship and Industrial Training Authority
2610/11_dep_167,Skills Development Fund Ltd.
2610/11_dep_168,Ceylon German Technical Training Institute
2610/11_dep_169,National Institute of Business Management and affiliated institutions
2610/11_dep_170,University of Vocational Technology
2610/11_dep_171,Sri Lanka Institute of Printing
2610/11_dep_172,Sri Lanka Institute of Information Technology (SLIIT) and all information technology centres affiliated to SLIIT
2610/11_dep_173,National Institute of Fisheries and Nautical Engineering (Ocean University)
2610/11_dep_174,National Institute of Technical Education
2610/11_dep_175,Department of Technical Education and Training
2610/11_dep_176,Sri Lanka Institute of Advanced Technological Education
2610/11_dep_177,All District Secretariats
2610/11_dep_178,All Divisional Secretariats
2610/11_dep_179,Department of Registrar General
2610/11_dep_180,Department of Immigration and Emigration
2610/11_dep_181,Department of Registration of Persons
2610/11_dep_182,Department of Cultural Affairs
2610/11_dep_183,Department of National Museum
2610/11_dep_184,Department of Commerce
2610/11_dep_185,Registrar of Companies
2610/11_dep_186,National Intellectual Property Office of Sri Lanka
2610/11_dep_187,Industrial Development Board
2610/11_dep_188,Consumer Affairs Authority
2610/11_dep_189,Lanka Sathosa Ltd.
2610/11_dep_190,Lanka General Trading Company Ltd.
2610/11_dep_191,Co-operative Wholesale Establishment
2610/11_dep_192,"Department of Measurement Units, Standards and Services"
2610/11_dep_193,Department of Food Commissioner
2610/11_dep_194,Department of Co-operative Development (Registrar of Co-operative Societies)
2610/11_dep_195,Co-operative Employees Commission
2610/11_dep_196,Internal Trade Department
2610/11_dep_197,National Institute of Cooperative Development
2610/11_dep_198,Sri Lanka Institute of Textile and Apparels
2610/11_dep_199,Department of Textile Industries
2610/11_dep_200,Kahatagaha Graphite
2610/11_dep_201,Lanka Leyland Ltd.
2610/11_dep_202,Lanka Ashok Leyland Ltd.
2610/11_dep_203,Lanka Cement Ltd.
2610/11_dep_204,Sri Lanka Cement Corporation
2610/11_dep_205,Manthai Salt Ltd.
2610/11_dep_206,Elephant Pass Saltern
2610/11_dep_207,Lanka Textile Mills Emporium Ltd.
2610/11_dep_208,Lanka Salusala Ltd.
2610/11_dep_209,National Enterprise Development Authority
2610/11_dep_210,National Crafts Council
2610/11_dep_211,Sri Lanka Handicraft Board (Laksala)
2610/11_dep_212,National Design Centre
2610/11_dep_213,SME Venture Capital Company
2610/11_dep_214,SME Authority
2610/11_dep_215,Hingurana Sugar Industry Ltd.
2610/11_dep_216,Ceylon Sugar (Pvt.) Ltd.
2610/11_dep_217,National Paper Corporation Ltd.
2610/11_dep_218,Lanka Mineral Sands Company
2610/11_dep_219,Paranthan Chemicals Ltd.
2610/11_dep_220,Urban Development Authority
2610/11_dep_221,Sri Lanka Land Reclamation and Development Corporation
2610/11_dep_222,National Physical Planning Department
2610/11_dep_223,Department of Fisheries and Aquatic Resources
2610/11_dep_224,National Aquaculture Development Authority
2610/11_dep_225,Ceylon Fishery Harbours Corporation
2610/11_dep_226,Cey-Nor Foundation Ltd.
2610/11_dep_227,Ceylon Fisheries Corporation
2610/11_dep_228,National Aquatic Resources Research and Development Agency
2610/11_dep_229,Department of Rubber Development
2610/11_dep_230,National Institute of Plantation Management
2610/11_dep_231,Sri Lanka Tea Board
2610/11_dep_232,Tea Small Holdings Development Authority
2610/11_dep_233,Tea and Rubber Estates (Control and Fragmentation) Board
2610/11_dep_234,Tea Shakthi Fund
2610/11_dep_235,Thurusaviya Fund
2610/11_dep_236,Tea Research Institute
2610/11_dep_237,Rubber Research Institute
2610/11_dep_238,Coconut Cultivation Board
2610/11_dep_239,Coconut Development Authority
2610/11_dep_240,Coconut Research Institute
2610/11_dep_241,Sugarcane Research Institute
2610/11_dep_242,Kalubovitiyana Tea Factory Ltd.
2610/11_dep_243,Sri Lanka Rubber Manufacturing and Export Corporation
2610/11_dep_244,Ceylon Electricity Board and its subsidiary companies
2610/11_dep_245,Lanka Electricity Company
2610/11_dep_246,Lanka Coal Company (Pvt.) Ltd.
2610/11_dep_247,LTL Holdings (Pvt.) Ltd.
2610/11_dep_248,Sri Lanka Sustainable Energy Authority
2610/11_dep_249,Sri Lanka Atomic Energy Board
2610/11_dep_250,Sri Lanka Atomic Energy Regulatory Council
2610/11_dep_251,Department of Agriculture
2610/11_dep_252,Department of Agrarian Development
2610/11_dep_253,National Fertilizer Secretariat
2610/11_dep_254,Agriculture and Agrarian Insurance Board
2610/11_dep_255,National Agricultural Diversification and Settlement Authority (Hadabima)
2610/11_dep_256,Sri Lanka National Freedom from Hunger Campaign Board
2610/11_dep_257,Pulses and Grain Research and Production Authority
2610/11_dep_258,Hector Kobbekaduwa Agrarian Research and Training Institute
2610/11_dep_259,Sri Lanka Council for Agricultural Research Policy
2610/11_dep_260,Institute of Post-Harvest Technology
2610/11_dep_261,Ceylon Fertilizer Company Ltd.
2610/11_dep_262,Colombo Commercial Fertilizer Company
2610/11_dep_263,Janatha Fertilizer Enterprises Ltd.
2610/11_dep_264,Lanka Phosphate Company Ltd
2610/11_dep_265,Department of Buddhist Affairs
2610/11_dep_266,Buddha Sasana Fund
2610/11_dep_267,International Buddhist Centre
2610/11_dep_268,Attorney General's Department
2610/11_dep_269,Legal Draftsman's Department
2610/11_dep_270,Department of Debt Conciliation Board
2610/11_dep_271,Department of Government Analyst
2610/11_dep_272,Office of the Registrar of the Supreme Court
2610/11_dep_273,Law Commission of Sri Lanka
2610/11_dep_274,Superior Courts Complex Board of Management
2610/11_dep_275,Legal Aid Commission of Sri Lanka
2610/11_dep_276,Mediation Boards Commission
2610/11_dep_277,Council of Legal Education
2610/11_dep_278,Department of Public Trustee
2610/11_dep_279,Rural Resuscitation Fund
2610/11_dep_280,Rural Economic Resuscitation Fund (Finance)
2610/11_dep_281,Janadiriya Fund (Gramodaya Mandala Fund)
2610/11_dep_282,Department of Animal Production and Health
2610/11_dep_283,National Livestock Development Board and associated companies
2610/11_dep_284,Kiriya Milk Industries Lanka (Pvt.) Ltd.
2610/11_dep_285,Milk Industries Lanka Ltd.
2610/11_dep_286,Mahaweli Livestock Enterprises Ltd.
2610/11_dep_287,Paddy Marketing Board
2610/11_dep_288,Regional Economic Centres
2610/11_dep_289,Bogala Graphite Lanka Ltd.
2610/11_dep_290,Ceylon Ceramics Corporation (Brick and Tiles) Division
2610/11_dep_291,Kahagolle Engineering Services Company Ltd. (KESCO)
2610/11_dep_292,BCC Limited
2610/11_dep_293,Public Resources Management Corporation
2610/11_dep_294,Hotel Developers (Lanka) PLC ( PQ 143)
2610/11_dep_295,Sri Lankan Air Line Ltd. and its subsidiaries
2610/11_dep_296,Mihin Lanka (Pvt.) Ltd.
2610/11_dep_297,Insurance Corporation of Sri Lanka and its subsidiaries and associated companies
2610/11_dep_298,All state Banks and its subsidiaries and associated companies
2610/11_dep_299,Lakdiva Engineering Ltd.
2610/11_dep_300,Werahara Engineering Services Ltd. (WESCO)
2610/11_dep_301,Janatha Estate Development Board
2610/11_dep_302,Sri Lanka State Plantation Corporation
2610/11_dep_303,Elkaduwa Plantation Company Ltd.
2610/11_dep_304,Kurunegala Plantation Company Ltd.
2610/11_dep_305,Chilaw Plantation Company Ltd.
2610/11_dep_306,Galoya Plantation (Pvt.) Company
2610/11_dep_307,Sri Lanka Cashew Corporation
2610/11_dep_308,Sri Lanka Institute of Development Administration
2610/11_dep_309,Distance Learning Centre Ltd.
2610/11_dep_310,Department of Pensions
2610/11_dep_311,Public Service Pensioners' Trust Fund
2610/11_dep_312,Productivity Secretariat
2610/11_dep_313,Department of Information
2610/11_dep_314,Department of Government Printing
2610/11_dep_315,Sri Lanka Press Council
2610/11_dep_316,Sri Lanka Broadcasting Corporation
2610/11_dep_317,Sri Lanka Rupavahini Corporation
2610/11_dep_318,Independent Television Network
2610/11_dep_319,State Printing Corporation
2610/11_dep_320,Associated Newspapers of Ceylon Ltd.
2610/11_dep_321,Lanka Puwath Ltd.
2610/11_dep_322,Selacine Rupavahini Institute
2610/11_dep_323,Creative Helanka Ltd.
2610/11_dep_324,National Film Corporation
2610/11_dep_325,Sri Lanka Television Training Institute
2610/11_dep_326,Mahinda Rajapaksa National Tele-cinema Park (Ranmihithenna)
2610/11_dep_327,The Urban Settlement Development Authority
2610/11_dep_328,National Housing Development Authority
2610/11_dep_329,Condominium Management Authority (Common Amenities Board)
2610/11_dep_330,Centre for Housing Planning and Building
2610/11_dep_331,Building Materials Corporation
2610/11_dep_332,Department of Buildings
2610/11_dep_333,Government Factory
2610/11_dep_334,Construction Industry Development Authority
2610/11_dep_335,State Engineering Corporation
2610/11_dep_336,State Development and Construction Corporation
2610/11_dep_337,Devco Showa (Pvt.) Ltd.
2610/11_dep_338,National Equipment and Machinery Organization
2610/11_dep_339,Sri Lanka Ports Authority and its Subsidiaries and Associates
2610/11_dep_340,Ceylon Shipping Corporation Ltd and its Subsidiaries and Associates
2610/11_dep_341,Merchant Shipping Secretariat
2610/11_dep_342,Shipping & Aviation Information and Research (Pvt) Ltd.
2610/11_dep_343,Department of Land Commissioner General
2610/11_dep_344,Land Reform Commission
2610/11_dep_345,Department of Land Settlement
2610/11_dep_346,Department of Surveyor General
2610/11_dep_347,Institute of Surveying and Mapping
2610/11_dep_348,Land Survey Council
2610/11_dep_349,Department of Land Use Policy Planning
2610/11_dep_350,Kantalai Sugar Company
2610/11_dep_351,Rural Community Development (Youth Empowerment) Project
2610/11_dep_352,Estate Sector Self-employment Revolving Fund
2610/11_dep_353,Plantation Housing Development Trust
2610/11_dep_354,Saumyamoorthi Thondaman Memorial Foundation
2610/11_dep_355,Sri Lanka Women's Bureau
2610/11_dep_356,National Committee on Women
2610/11_dep_357,Department of Probation and Childcare Services
2610/11_dep_358,National Child Protection Authority
2610/11_dep_359,Children's Secretariat
2610/11_dep_360,Sri Lanka Bureau of Foreign Employment
2610/11_dep_361,Sri Lanka Foreign Employment Agency
2610/11_dep_362,Department of Examinations
2610/11_dep_363,Department of Educational Publications
2610/11_dep_364,National Institute of Education
2610/11_dep_365,Sri Lanka Publication Development Bureau
2610/11_dep_366,National Library and Documentation Services Board
2610/11_dep_367,Directorates of Education
2610/11_dep_368,National Authority on Teachers Education
2610/11_dep_369,Colleges of Education
2610/11_dep_370,Teachers' Colleges
2610/11_dep_371,UNESCO National Commission of Sri Lanka
2610/11_dep_372,Piriven Education Board
2610/11_dep_373,Department of Archaeology
2610/11_dep_374,Tower Hall Theatre Foundation
2610/11_dep_375,Public Performance Board
2610/11_dep_376,National Performing Arts Centre
2610/11_dep_377,National Arts Council
2610/11_dep_378,Gramodaya Folk Arts Centre
2610/11_dep_379,Ape Gama
2610/11_dep_380,Department of National Archives
2610/11_dep_381,Central Cultural Fund
2610/11_dep_382,Postal Department
2610/11_dep_383,Department of Muslim Religious and Cultural Affairs
2610/11_dep_384,Resettlement Authority
2610/11_dep_385,"Rehabilitation of Persons, Properties and Industries Authority"
2610/11_dep_386,Commissioner General of Rehabilitation
2610/11_dep_387,Department of Hindu Religious and Cultural Affairs
2610/11_dep_388,Palmyrah Development Board
2610/11_dep_389,North Sea Ltd.
2610/11_dep_390,Ceylon Petroleum Corporation
2610/11_dep_391,Ceylon Petroleum Storage Terminal Ltd.
2610/11_dep_392,Petroleum Resources Development Secretariat
2610/11_dep_393,Polipto Lanka (Pvt.) Ltd.
2610/11_dep_394,Department of Sports Development
2610/11_dep_395,Sugathadasa National Sports Complex Authority
2610/11_dep_396,National Institute of Sports Science
2610/11_dep_397,National Sports Council
2610/11_dep_398,Institute of Sports Medicine
2610/11_dep_399,Sri Lanka Anti-doping Agency
2610/11_dep_400,Galle Heritage Foundation
2610/11_dep_401,Information and Communication Technology Agency
2610/11_dep_402,"Sri Lanka Telecom Ltd, and its subsidiaries and associates"
2610/11_dep_403,Department of Telecommunication (under liquidation)
2610/11_dep_404,All Information Technology Parks
2610/11_dep_405,Department of Official Languages
2610/11_dep_406,Official Languages Commission
2610/11_dep_407,National Institute of Language Education and Training
2610/11_dep_408,Secretariat for Non-Governmental Organization
2610/11_dep_409,Department of Export Agriculture
2610/11_dep_410,Department of Irrigation
2610/11_dep_411,Water Resources Board
2610/11_dep_412,Riverine Bamboo Project
2610/11_dep_413,Sri Lanka Institute of Local Government
2610/11_dep_414,Local Loans and Development Fund
2610/11_dep_415,Board of Investment of Sri Lanka
2610/11_dep_416,Sri Lanka Export Development Board
2610/11_dep_417,Department of Import and Export
2610/11_dep_418,Mahapola Higher Education Scholarship Trust Fund